{
  "schemaVersion": 1,
  "id": "netease-cloud-music",
  "familyId": "netease-cloud-music",
  "variant": "anonymous",
  "authRequirement": "none",
  "platforms": ["web", "desktop"],
  "name": "NetEase Cloud Music",
  "description": "Anonymous NetEase catalog access through a user-configured trusted HTTPS gateway.",
  "publisher": { "name": "DancingMusic", "url": "https://github.com/DancingMusic" },
  "repository": "https://github.com/DancingMusic/MusicConnect-NetEase",
  "homepage": "https://dancingmusic.github.io/MusicConnect-NetEase/",
  "license": "MIT",
  "version": "0.5.3",
  "protocolVersion": ">=0.2.0",
  "capabilities": ["search", "stream", "lyrics", "playlist"],
  "artifact": { "url": "https://cdn.jsdelivr.net/gh/DancingMusic/MusicConnect-NetEase@v0.5.3/dist/index.js", "format": "esm", "integrity": "sha256-P9zdKio45DxFur00AwjggWaNiTFmwjvtLqs4Ks/YEHU=" },
  "permissions": {
    "networkOrigins": [],
    "artworkOrigins": [
      "https://p1.music.126.net",
      "https://p2.music.126.net",
      "https://p3.music.126.net",
      "https://p4.music.126.net"
    ],
    "account": false
  },
  "discovery": { "recommendedRegions": ["mainland"], "priority": 90 },
  "tags": ["netease", "anonymous", "self-hosted-gateway", "lyrics", "playlist"],
  "distribution": { "channel": "developer-only" },
  "status": "unlisted",
  "submittedAt": "2026-06-11T00:00:00.000Z",
  "updatedAt": "2026-07-16T00:00:00.000Z"
}
