{
  "schemaVersion": 1,
  "id": "internet-archive",
  "familyId": "internet-archive",
  "variant": "anonymous",
  "authRequirement": "none",
  "platforms": ["web", "desktop"],
  "name": "Internet Archive",
  "description": "Public and community audio from the Internet Archive catalog.",
  "publisher": { "name": "DancingMusic", "url": "https://github.com/DancingMusic" },
  "repository": "https://github.com/DancingMusic/MusicConnect-Archive",
  "homepage": "https://dancingmusic.github.io/MusicConnect-Archive/",
  "license": "MIT",
  "version": "0.4.2",
  "protocolVersion": ">=0.2.0",
  "capabilities": ["search", "stream", "lyrics", "playlist"],
  "artifact": { "url": "https://cdn.jsdelivr.net/gh/DancingMusic/MusicConnect-Archive@v0.4.2/dist/index.js", "format": "esm", "integrity": "sha256-nkDs5y6LW92AN9P4gQELtF33DxkfSAHolVTe6IcFNOw=" },
  "permissions": { "networkOrigins": ["https://archive.org", "https://lrclib.net"] },
  "discovery": { "recommendedRegions": ["global"], "priority": 70 },
  "tags": ["archive", "community-audio", "open-audio"],
  "distribution": { "channel": "official-authorized", "reviewedAt": "2026-07-27T00:00:00.000Z" },
  "status": "active",
  "submittedAt": "2026-06-11T00:00:00.000Z",
  "updatedAt": "2026-07-12T00:00:00.000Z"
}
