{
  "schemaVersion": 1,
  "id": "netease-cloud-music-account",
  "familyId": "netease-cloud-music",
  "variant": "account",
  "authRequirement": "required",
  "platforms": ["desktop"],
  "name": "NetEase Cloud Music Account",
  "description": "NetEase account login, profile summary, account playlists and catalog access through the official web session and a bounded host-owned provider adapter.",
  "publisher": { "name": "DancingMusic", "url": "https://github.com/DancingMusic" },
  "repository": "https://github.com/DancingMusic/MusicConnect-NetEase-Account",
  "homepage": "https://dancingmusic.github.io/MusicConnect-NetEase-Account/",
  "license": "MIT",
  "version": "0.3.1",
  "protocolVersion": ">=0.4.0",
  "capabilities": ["search", "stream", "lyrics", "playlist", "login"],
  "artifact": { "url": "https://cdn.jsdelivr.net/gh/DancingMusic/MusicConnect-NetEase-Account@v0.3.1/dist/index.js", "format": "esm", "integrity": "sha256-cq9bo+FDCBUan7PnCs/3DYhcKUC1RIdJo7VzOvMzuYU=" },
  "permissions": {
    "networkOrigins": [],
    "artworkOrigins": [
      "https://p1.music.126.net",
      "https://p2.music.126.net",
      "https://p3.music.126.net",
      "https://p4.music.126.net"
    ],
    "account": true
  },
  "discovery": { "recommendedRegions": ["mainland"], "priority": 90 },
  "tags": ["netease", "account", "official-web-login", "official-provider", "qr-login", "desktop"],
  "distribution": { "channel": "developer-only" },
  "status": "unlisted",
  "submittedAt": "2026-07-12T14:15:00.000Z",
  "updatedAt": "2026-07-17T23:35:00.000Z"
}
