{
  "schemaVersion": 1,
  "id": "spotify",
  "familyId": "spotify",
  "variant": "account",
  "authRequirement": "required",
  "platforms": ["web", "desktop"],
  "name": "Spotify Preview",
  "description": "Spotify Web API search, playlists, metadata, and available preview clips.",
  "publisher": { "name": "DancingMusic", "url": "https://github.com/DancingMusic" },
  "repository": "https://github.com/DancingMusic/MusicConnect-Spotify",
  "homepage": "https://dancingmusic.github.io/MusicConnect-Spotify/",
  "license": "MIT",
  "version": "0.3.2",
  "protocolVersion": ">=0.2.0",
  "capabilities": ["search", "stream", "playlist", "login"],
  "artifact": { "url": "https://cdn.jsdelivr.net/gh/DancingMusic/MusicConnect-Spotify@v0.3.2/dist/index.js", "format": "esm", "integrity": "sha256-haF8dFrWbObmkJNrgZTAUFa/cwkVqph3rey7d/R8ECk=" },
  "permissions": { "networkOrigins": ["https://api.spotify.com"], "account": true },
  "discovery": { "recommendedRegions": ["global"], "priority": 100 },
  "tags": ["spotify", "preview", "playlist"],
  "distribution": { "channel": "developer-only" },
  "status": "unlisted",
  "submittedAt": "2026-06-11T00:00:00.000Z",
  "updatedAt": "2026-07-12T00:00:00.000Z"
}
