{
  "schemaVersion": 1,
  "id": "itunes",
  "familyId": "itunes",
  "variant": "anonymous",
  "authRequirement": "none",
  "platforms": ["web", "desktop"],
  "name": "iTunes Preview",
  "description": "Apple iTunes catalog search, charts, and official preview clips.",
  "publisher": { "name": "DancingMusic", "url": "https://github.com/DancingMusic" },
  "repository": "https://github.com/DancingMusic/MusicConnect-iTunes",
  "homepage": "https://dancingmusic.github.io/MusicConnect-iTunes/",
  "license": "MIT",
  "version": "0.5.2",
  "protocolVersion": ">=0.2.0",
  "capabilities": ["search", "stream", "lyrics", "playlist"],
  "artifact": { "url": "https://cdn.jsdelivr.net/gh/DancingMusic/MusicConnect-iTunes@v0.5.2/dist/index.js", "format": "esm", "integrity": "sha256-EZBtiQRuCIi1yizmNURoVheuw6c4wzz6ra3HUhnVk6w=" },
  "permissions": { "networkOrigins": ["https://itunes.apple.com", "https://lrclib.net", "https://rss.applemarketingtools.com"] },
  "discovery": { "recommendedRegions": ["global"], "priority": 90 },
  "tags": ["apple", "itunes", "preview"],
  "distribution": { "channel": "official-authorized", "reviewedAt": "2026-07-27T00:00:00.000Z" },
  "status": "active",
  "submittedAt": "2026-06-11T00:00:00.000Z",
  "updatedAt": "2026-07-12T00:00:00.000Z"
}
