{
  "schemaVersion": 1,
  "id": "radio-browser",
  "familyId": "radio-browser",
  "variant": "anonymous",
  "authRequirement": "none",
  "platforms": ["web", "desktop"],
  "name": "Radio Browser",
  "description": "Community-maintained internet radio station search and live streams.",
  "publisher": { "name": "DancingMusic", "url": "https://github.com/DancingMusic" },
  "repository": "https://github.com/DancingMusic/MusicConnect-Radio",
  "homepage": "https://dancingmusic.github.io/MusicConnect-Radio/",
  "license": "MIT",
  "version": "0.1.3",
  "protocolVersion": ">=0.2.0",
  "capabilities": ["search", "stream"],
  "artifact": { "url": "https://cdn.jsdelivr.net/gh/DancingMusic/MusicConnect-Radio@v0.1.3/dist/index.js", "format": "esm", "integrity": "sha256-FZyWRINebHVjroaGqRPynmxz6cnj3Jps8c4NaciNm3g=" },
  "permissions": { "networkOrigins": ["https://de1.api.radio-browser.info", "https://de2.api.radio-browser.info", "https://fi1.api.radio-browser.info"] },
  "discovery": { "recommendedRegions": ["global"], "priority": 60 },
  "tags": ["radio", "live", "community"],
  "distribution": { "channel": "official-authorized", "reviewedAt": "2026-07-27T00:00:00.000Z" },
  "status": "active",
  "submittedAt": "2026-06-11T00:00:00.000Z",
  "updatedAt": "2026-07-12T00:00:00.000Z"
}
